{
  "uavs": [
    "U01",
    "U02",
    "U03",
    "U04"
  ],
  "far_radars": [
    "F01",
    "F02",
    "F03"
  ],
  "frames": [
    "K01"
  ],
  "far_working_bandwidth": {
    "F01": 11.75,
    "F02": 13.0,
    "F03": 14.25
  },
  "uav_far_jsr": {
    "K01": {
      "U01": {
        "F01": 6.4,
        "F02": 6.68,
        "F03": 6.96
      },
      "U02": {
        "F01": 7.24,
        "F02": 7.52,
        "F03": 7.8
      },
      "U03": {
        "F01": 5.0,
        "F02": 5.28,
        "F03": 5.56
      },
      "U04": {
        "F01": 5.84,
        "F02": 6.12,
        "F03": 6.4
      }
    }
  },
  "effect_function_parameters": {
    "JSR0": 5.0,
    "L": 1.35
  },
  "cost_factor": 0.42,
  "uav_far_feasibility": {
    "K01": {
      "U01": {
        "F01": 1,
        "F02": 0,
        "F03": 1
      },
      "U02": {
        "F01": 0,
        "F02": 1,
        "F03": 1
      },
      "U03": {
        "F01": 1,
        "F02": 1,
        "F03": 1
      },
      "U04": {
        "F01": 1,
        "F02": 1,
        "F03": 0
      }
    }
  },
  "dynamic_frame_data": {
    "K01": {
      "far_band_observation": {
        "F01": 9.75,
        "F02": 11.0,
        "F03": 12.25
      },
      "environment_factor": 1.0,
      "frame_sequence_number": 1
    }
  }
}
